{
  "case_id": "SG8-12409ecb4ebb496f9a2423a47f9aa099",
  "supplier_id": "S037",
  "agent": "optimization",
  "status": "SUCCEEDED",
  "data": {
    "status": "OPTIMAL",
    "solver": "SCIP 10.0.0 [LP solver: SoPlex 8.0.0]",
    "original_step5_candidates": 112,
    "full_on_time_stock_candidates": 107,
    "production_job_candidates": 65,
    "procurement_lot_candidates": 0,
    "production_candidate_limits": {
      "BOM material impossible before production start": 125
    },
    "variables": 5489,
    "constraints": 5576,
    "route_capacity_mode": "single-batch",
    "plan": {
      "finished_transfers": [
        {
          "order_id": "O096166",
          "product_id": "P050",
          "action_type": "Expedite_Inventory_Transfer",
          "component_id": "",
          "supplier_id": "",
          "factory_id": "F010",
          "route_id": "R0988",
          "source_location": "W023",
          "destination_location": "W030",
          "available_capacity": 962,
          "recoverable_units": 9,
          "quantity_basis": "finished product units",
          "action_cost": "139.86",
          "cost_basis": "Transport-only quote: variable cost plus fixed dispatch fee",
          "implementation_time": 1,
          "arrival_date": "2027-01-02",
          "time_saved_days": 11,
          "timing_basis": "Finished-stock arrival improvement versus assumed baseline",
          "remaining_late_days": 0,
          "success_probability_proxy": 0.529688,
          "feasible": true,
          "feasibility_scope": "Local finished-product transfer; handling time and joint commitments not modeled",
          "full_order_quantity_covered": true,
          "resource_demands": {
            "stock:W023:P050": 9,
            "route:R0988:consignment": 9
          },
          "assumptions": [
            "Spare unreserved stock above safety after existing allocations",
            "Direct listed route",
            "No additional handling time"
          ],
          "action_id": "MG000004",
          "currency": "USD",
          "risk_score_proxy": 0.470312
        },
        {
          "order_id": "O073019",
          "product_id": "P041",
          "action_type": "Reallocate_Inventory",
          "component_id": "",
          "supplier_id": "",
          "factory_id": "F001",
          "route_id": "R0929",
          "source_location": "W014",
          "destination_location": "W030",
          "available_capacity": 885,
          "recoverable_units": 3,
          "quantity_basis": "finished product units",
          "action_cost": "30.63",
          "cost_basis": "Transport-only quote: variable cost plus fixed dispatch fee",
          "implementation_time": 1,
          "arrival_date": "2027-01-02",
          "time_saved_days": 11,
          "timing_basis": "Finished-stock arrival improvement versus assumed baseline",
          "remaining_late_days": 0,
          "success_probability_proxy": 0.543917,
          "feasible": true,
          "feasibility_scope": "Local finished-product transfer; handling time and joint commitments not modeled",
          "full_order_quantity_covered": true,
          "resource_demands": {
            "stock:W014:P041": 3,
            "route:R0929:consignment": 3
          },
          "assumptions": [
            "Spare unreserved stock above safety after existing allocations",
            "Direct listed route",
            "No additional handling time"
          ],
          "action_id": "MG000012",
          "currency": "USD",
          "risk_score_proxy": 0.456083
        },
        {
          "order_id": "O061542",
          "product_id": "P099",
          "action_type": "Reallocate_Inventory",
          "component_id": "",
          "supplier_id": "",
          "factory_id": "F019",
          "route_id": "R0999",
          "source_location": "W012",
          "destination_location": "W008",
          "available_capacity": 1046,
          "recoverable_units": 2,
          "quantity_basis": "finished product units",
          "action_cost": "31.01",
          "cost_basis": "Transport-only quote: variable cost plus fixed dispatch fee",
          "implementation_time": 1,
          "arrival_date": "2027-01-02",
          "time_saved_days": 12,
          "timing_basis": "Finished-stock arrival improvement versus assumed baseline",
          "remaining_late_days": 0,
          "success_probability_proxy": 0.398072,
          "feasible": true,
          "feasibility_scope": "Local finished-product transfer; handling time and joint commitments not modeled",
          "full_order_quantity_covered": true,
          "resource_demands": {
            "stock:W012:P099": 2,
            "route:R0999:consignment": 2
          },
          "assumptions": [
            "Spare unreserved stock above safety after existing allocations",
            "Direct listed route",
            "No additional handling time"
          ],
          "action_id": "MG000014",
          "currency": "USD",
          "risk_score_proxy": 0.601928
        },
        {
          "order_id": "O028747",
          "product_id": "P015",
          "action_type": "Reallocate_Inventory",
          "component_id": "",
          "supplier_id": "",
          "factory_id": "F015",
          "route_id": "R0913",
          "source_location": "W019",
          "destination_location": "W008",
          "available_capacity": 356,
          "recoverable_units": 2,
          "quantity_basis": "finished product units",
          "action_cost": "34.72",
          "cost_basis": "Transport-only quote: variable cost plus fixed dispatch fee",
          "implementation_time": 2,
          "arrival_date": "2027-01-03",
          "time_saved_days": 11,
          "timing_basis": "Finished-stock arrival improvement versus assumed baseline",
          "remaining_late_days": 0,
          "success_probability_proxy": 0.330161,
          "feasible": true,
          "feasibility_scope": "Local finished-product transfer; handling time and joint commitments not modeled",
          "full_order_quantity_covered": true,
          "resource_demands": {
            "stock:W019:P015": 2,
            "route:R0913:consignment": 2
          },
          "assumptions": [
            "Spare unreserved stock above safety after existing allocations",
            "Direct listed route",
            "No additional handling time"
          ],
          "action_id": "MG000016",
          "currency": "USD",
          "risk_score_proxy": 0.669839
        },
        {
          "order_id": "O075100",
          "product_id": "P071",
          "action_type": "Reallocate_Inventory",
          "component_id": "",
          "supplier_id": "",
          "factory_id": "F011",
          "route_id": "R0941",
          "source_location": "W014",
          "destination_location": "W006",
          "available_capacity": 459,
          "recoverable_units": 5,
          "quantity_basis": "finished product units",
          "action_cost": "48.71",
          "cost_basis": "Transport-only quote: variable cost plus fixed dispatch fee",
          "implementation_time": 2,
          "arrival_date": "2027-01-03",
          "time_saved_days": 11,
          "timing_basis": "Finished-stock arrival improvement versus assumed baseline",
          "remaining_late_days": 0,
          "success_probability_proxy": 0.577357,
          "feasible": true,
          "feasibility_scope": "Local finished-product transfer; handling time and joint commitments not modeled",
          "full_order_quantity_covered": true,
          "resource_demands": {
            "stock:W014:P071": 5,
            "route:R0941:consignment": 5
          },
          "assumptions": [
            "Spare unreserved stock above safety after existing allocations",
            "Direct listed route",
            "No additional handling time"
          ],
          "action_id": "MG000020",
          "currency": "USD",
          "risk_score_proxy": 0.422643
        },
        {
          "order_id": "O093565",
          "product_id": "P071",
          "action_type": "Reallocate_Inventory",
          "component_id": "",
          "supplier_id": "",
          "factory_id": "F011",
          "route_id": "R0929",
          "source_location": "W014",
          "destination_location": "W030",
          "available_capacity": 459,
          "recoverable_units": 5,
          "quantity_basis": "finished product units",
          "action_cost": "30.84",
          "cost_basis": "Transport-only quote: variable cost plus fixed dispatch fee",
          "implementation_time": 1,
          "arrival_date": "2027-01-02",
          "time_saved_days": 12,
          "timing_basis": "Finished-stock arrival improvement versus assumed baseline",
          "remaining_late_days": 0,
          "success_probability_proxy": 0.543917,
          "feasible": true,
          "feasibility_scope": "Local finished-product transfer; handling time and joint commitments not modeled",
          "full_order_quantity_covered": true,
          "resource_demands": {
            "stock:W014:P071": 5,
            "route:R0929:consignment": 5
          },
          "assumptions": [
            "Spare unreserved stock above safety after existing allocations",
            "Direct listed route",
            "No additional handling time"
          ],
          "action_id": "MG000022",
          "currency": "USD",
          "risk_score_proxy": 0.456083
        },
        {
          "order_id": "O018173",
          "product_id": "P090",
          "action_type": "Reallocate_Inventory",
          "component_id": "",
          "supplier_id": "",
          "factory_id": "F010",
          "route_id": "R0969",
          "source_location": "W030",
          "destination_location": "W015",
          "available_capacity": 476,
          "recoverable_units": 8,
          "quantity_basis": "finished product units",
          "action_cost": "42.26",